{"codeHash":"a8d0e674afa5b9bbdb5fa1d1c7cee1a7b31f997b0112b09683c997748d58a2ff","cryptoContextHash":"9e0dd267df3b932e612ba0b466275ad094d6705606142f2b61949c7eacad046a","keyEpoch":"room-state-v1","operator":"private_model_evaluation","orderedInputs":[{"artifactCommitment":"23551ed238b11255682122008cc3a15b0a6fc7813178fa9145497d2e795fc8e9","artifactId":"model-nn-layer1-weight","parentIndex":0},{"artifactCommitment":"33f72921c883258f200f409e74f643be272a7894b4c7bb1c9ec3e073ab60b347","artifactId":"model-nn-layer1-bias","parentIndex":0},{"artifactCommitment":"99a773229772b85a8609bf2e2fed515eff9357a5c9c892f6f3988d2e28a26556","artifactId":"model-nn-output-weight","parentIndex":0},{"artifactCommitment":"4b6714edcc6fe85eadc9922d213ad1a462d0515b514fabbc7a96005b8e0c000f","artifactId":"model-nn-output-bias","parentIndex":0},{"artifactCommitment":"0b2e2e34f774fe01bf86bf86d50df80dba1c9d3f13f9044dd63a328e5fc0d1f2","artifactId":"match-mask","parentIndex":1},{"artifactCommitment":"a2b416dd2bea5c03bd91c5efcc2b5208f8addcba8fb2a3e8d8d191c6ef7c0bfb","artifactId":"lab-a-features","parentIndex":1},{"artifactCommitment":"a90d6fae27d7d20fc6e563b2d51b09a05f5c7ae89f65fd547e58e65903c773f3","artifactId":"lab-b-features","parentIndex":1}],"orderedOutputs":[{"artifactCommitment":"0d038afddc9b382bf78c69ef46ff0914914a5d044b0ca32448a298007ebe6b24","artifactId":"model-evaluation-mse"}],"orderedParents":[{"policyHash":"1a7d67bf4c746a788b90d63a9e715b0615d82c263055ad7abc1b8a8379c38f99","stateCommitment":"0995e7ecd45325e45f2e4de880d4cc8bf16e7a7d7aa2484595f0051ab6ff3e9d","stateId":"S3_model"},{"policyHash":"77cc6a5df6a878f60514865ac06ee83baba73b8c68ccc776ad7fc82afd6fea06","stateCommitment":"cb23d577ab92e930d861c5bc3146be7539afe29f9ecc05001620d141daf87c7c","stateId":"S1"}],"outputPolicyHash":"2ff8ea4a410c3aa788c7ca05024782031e72768fc248e6506b7ff7b5c6b9ee98","outputStateCommitment":"4783c68ffbae1b11475a009ccd421b15045287929143d0f975cb1842933d7a62","outputStateId":"S4_eval","proofDomain":"kryptroom.state-transition-proof.v1","requestedReveals":["model.evaluation.mse"],"requestedRevealsHash":"9a2ed6ac7ba34cd9eddaf15f5208bf270f80b803327e60d04666ff9c3124d751","roomId":"cancer-collaboration-room","transitionCommitment":"1283c79f6f9cd06e7f538bb7d9ed33594d0bd319988848bd93723a24b702f68f","transitionId":"private-model-evaluation-to-S4","version":"1","workflowHash":"d66c581c73dbe1953f73fc573d9377da3e792b350bc0f516475e57fef5ff5449"}